{
  "artifact_fingerprints": [
    "sha256:0000000000000000000000000000000000000000000000000000000000000000"
  ],
  "blockers": [
    "fixture"
  ],
  "bundle_fingerprint": "sha256:0000000000000000000000000000000000000000000000000000000000000000",
  "bundle_id": "fixture",
  "bundle_revision": 0,
  "handoff_fingerprint": "sha256:0000000000000000000000000000000000000000000000000000000000000000",
  "participant_commits": [
    "fixture"
  ],
  "ready": false,
  "remote_outcome": "not_requested",
  "schema_id": "star.change-bundle-handoff",
  "schema_version": 1
}